Rank,Song,Artist,Year,Lyrics,Source
43,i dont wanna go on with you like that,elton john,1988, ive always said that ones enough to love now i hear youre bragging one is not enough well someone told me youre not satisfied you got plans to make me one of four or fivei guess this kind of things just in your blood but you wont catch me carving up my love i aint no puzzle piece that needs to fit if it takes more than me lets call it quitscause i dont wanna go on with you like that dont wanna be a feather in your cap i just dont wanna tell you honey i aint mad but i dont wanna go on with you like that woah woah woah oh yeahit gets so hard sometimes to understand this vicious circles getting out of hand dont need an extra eye to see that the fire spreads a faster in a breezeand i dont wanna go on with you like that dont wanna be a feather in your cap i just dont wanna tell you honey i aint mad but i dont wanna go on with you like thatno i dont wanna go on with you like that one more set of boots on your welcome mat youll just have to quit them if you want me back cause i dont wanna go on with you like that oh oh oh oh yeahoh if you wanna spread it around sister thats just fine but i dont want no second hand feeding me lines if you wanna hold someone in the middle of the night call out the guards turn out the lightand i dont wanna go on with you like that dont wanna be a feather in your cap i just dont wanna tell you honey i aint mad but i dont wanna go on with you like thatno i dont wanna go on with you like that one more set of boots on your welcome mat youll just have to quit them if you want me back no i dont wanna go on with you like that oh oh oh oh yeah oh oh oh oh yeahi dont wanna i dont wanna ,1.0
71,candle in the wind,elton john,1988, goodbye norma jean though i never knew you at all you had the grace to hold yourself while those around you crawled they crawled out of the woodwork and they whispered into your brain they set you on the treadmill and they made you change your nameand it seems to me you lived your life like a candle in the wind never knowing who to cling to when the rain set in and i would liked to have known you but i was just a kid your candle burned out long before your legend ever didloneliness was tough the toughest role you ever played hollywood created a superstar and pain was the price you paid even when you died oh the press still hounded you all the papers had to say was that marilyn was found in the nudeand it seems to me you lived your life like a candle in the wind never knowing who to cling to when the rain set in and i would liked to have known you but i was just a kid your candle burned out long before your legend ever didgoodbye norma jean though i never knew you at all you had the grace to hold yourself while those around you crawledgoodbye norma jean from the young man in the twenty second row who sees you as something as more than sexual more than just our marilyn monroeand it seems to me you lived your life like a candle in the wind never knowing who to cling to when the rain set in and i would liked to have known you but i was just a kid your candle burned out long before your legend ever didthe candle burned out long before your legend ever did ,1.0
43,the one,elton john,1992, i saw you dancing out the ocean running fast along the sand a spirit born of earth and water fire flying from your handsin the instant that you love someone in the second that the hammer hits reality runs up your spine and the pieces finally fitand all i ever needed was the one like freedom fields where wild horses run when stars collide like you and i no shadows block the sun youre all ive ever needed baby youre the onethere are caravans we follow drunken nights in dark hotels when chances breathe between the silence where sex and love no longer gel ohfor each man in his time is cain until he walks along the beach and sees his future in the water a long lost heart within his reachand all i ever needed was the one like freedom fields where wild horses run when stars collide like you and i no shadows block the sun youre all ive ever needed oh baby youre the oneand all i ever needed was the one like freedom fields where wild horses run when stars collide like you and i no shadows block the sun oh youre all ive ever needed oh baby youre the oneall i ever needed was the one like freedom fields where wild horses run when stars collide like you and i no shadows block the sun oh youre all ive ever needed oh baby youre the one ,1.0
18,can you feel the love tonight,elton john,1994, theres a calm surrender to the rush of day when the heat of a rolling world can be turned away an enchanted moment and it sees me through its enough for this restless warrior just to be with youand can you feel the love tonight it is where we are its enough for this wide eyed wanderer that we got this far and can you feel the love tonight how its laid to rest its enough to make kings and vagabonds believe the very besttheres a time for everyone if they only learn that the twisting kaleidoscope moves us all in turn theres a rhyme and reason to the wild outdoors when the heart of this star crossed voyager beats in time with yoursand can you feel the love tonight it is where we are its enough for this wide eyed wanderer that we got this far and can you feel the love tonight how its laid to rest its enough to make kings and vagabonds believe the very best its enough to make kings and vagabonds believe the very best ,1.0
59,believe,elton john,1995, i believe in love its all we got love has no boundaries costs nothing to touch war makes money cancer sleeps curled up in my father and that means something to me churches and dictators politics and papers everything crumbles sooner or later but love i believe in lovei believe in love its all we got love has no boundaries no borders to cross love is simple hate breeds those who think difference is the child of disease father and son make love and guns families together kill someone without love i believe in lovewithout love i wouldnt believe in anything that lives and breathes without love id have no anger i wouldnt believe in the right to stand here without love i wouldnt believe i couldnt believe in you and i wouldnt believe in me without lovei believe in love i believe in love i believe in love ,1.0
1,something about the way you look tonight  candle in the wind 1997,elton john,1997,,
8,candle in the wind 1997,elton john,1998, goodbye englands rose may you ever grow in our hearts you were the grace that placed itself where lives were torn apart you called out to our country and you whispered to those in pain now you belong to heaven and the stars spell out your nameand it seems to me you lived your life like a candle in the wind never fading with the sunset when the rain set in and your footsteps will always fall here along englands greenest hills your candles burned out long before your legend ever willloveliness weve lost these empty days without your smile this torch well always carry for our nations golden child and even though we try the truth brings us to tears all our words cannot express the joy you brought us through the yearsand it seems to me you lived your life like a candle in the wind never fading with the sunset when the rain set in and your footsteps will always fall here along englands greenest hills your candles burned our long before your legend ever willgoodbye englands rose may you ever grow in our hearts you were the grace that placed itself where lives were torn apart goodbye englands rose from a country lost without your soul wholl miss the wings of your compassion more than youll ever knowand it seems to me you lived your life like a candle in the wind never fading with the sunset when the rain set in and your footsteps will always fall here along englands greenest hills your candles burned out long before your legend ever will ,1.0
