Rank,Song,Artist,Year,Lyrics,Source
40,rocket man,elton john,1972, she packed my bags last night pre flight zero hour nine am and im gonna be high as a kite by then i miss the earth so much i miss my wife its lonely out in space on such a timeless flightand i think its gonna be a long long time till touch down brings me round again to find im not the man they think i am at home oh no no no im a rocket man rocket man burning out his fuse up here aloneand i think its gonna be a long long time till touch down brings me round again to find im not the man they think i am at home oh no no no im a rocket man rocket man burning out his fuse up here alonemars aint the kind of place to raise your kids in fact its cold as hell and theres no one there to raise them if you didnt and all this science i dont understand its just my job five days a week a rocket man a rocket manand i think its gonna be a long long time till touch down brings me round again to find im not the man they think i am at home oh no no no im a rocket man rocket man burning out his fuse up here aloneand i think its gonna be a long long time till touch down brings me round again to find im not the man they think i am at home oh no no no im a rocket man rocket man burning out his fuse up here alonenow i think its gonna be a long long time and i think its gonna be a long long time and i think its gonna be a long long time and i think its gonna be a long long time  ,1.0
7,crocodile rock,elton john,1973, i remember when rock was young me and suzie had so much fun holding hands and skimming stones had an old gold chevy and a place of my own but the biggest kick i ever got was doing a thing called the crocodile rock while the other kids were rocking round the clock we were hopping and bopping to the crocodile rockwell crocodile rocking is something shocking when your feet just cant keep still i never knew me a better time and i guess i never will oh lawdy mama those friday nights when suzie wore her dresses tight and the crocodile rocking was out of sightla lalalala la lalalala la lalalala labut the years went by and the rock just died suzie went and left us for some foreign guy long nights crying by the record machine dreaming of my chevy and my old blue jeans but theyll never kill the thrills weve got burning up to the crocodile rock learning fast as the weeks went past we really thought the crocodile rock would lastwell crocodile rocking is something shocking when your feet just cant keep still i never knew me a better time and i guess i never will oh lawdy mama those friday nights when suzie wore her dresses tight and the crocodile rocking was out of sightla lalalala la lalalala la lalalala lai remember when rock was young me and suzie had so much fun holding hands and skimming stones had an old gold chevy and a place of my own but the biggest kick i ever got was doing a thing called the crocodile rock while the other kids were rocking round the clock we were hopping and bopping to the crocodile rockwell crocodile rocking is something shocking when your feet just cant keep still i never knew me a better time and i guess i never will oh lawdy mama those friday nights when suzie wore her dresses tight and the crocodile rocking was out of sightla lalalala la lalalala la lalalala la la lalalala la lalalala la lalalala la la lalalala la lalalala la lalalala la ,1.0
48,daniel,elton john,1973, daniel is traveling tonight on a plane i can see the red tail lights heading for spain oh and i can see daniel waving goodbye god it looks like daniel must be the clouds in my eyesthey say spain is pretty though ive never been well daniel says its the best place that hes ever seen oh and he should know hes been there enough lord i miss daniel oh i miss him so muchoh oh daniel my brother you are older than me do you still feel the pain of the scars that wont heal your eyes have died but you see more than i daniel youre a star in the face of the skyoh oh daniel my brother you are older than me do you still feel the pain of the scars that wont heal your eyes have died but you see more than i daniel youre a star in the face of the sky ,1.0
9,bennie and the jets,elton john,1974, hey kids shake it loose together the spotlights hitting something thats been known to change the weather well kill the fatted calf tonight so stick around youre gonna hear electric music solid walls of soundsay candy and ronnie have you seen them yet uh but theyre so spaced out bbbbennie and the jets oh but theyre weird and theyre wonderful oh bennie shes really keen shes got electric boots a mohair suit you know i read it in a magazine bbbbennie and the jetshey kids plug into the faithless maybe theyre blinded but bennie makes them ageless we shall survive let us take ourselves along where we fight our parents out in the streets to find whos right and whos wrongoh candy and ronnie have you seen them yet oh but theyre so spaced out bennie and the jets oh but theyre weird and theyre wonderful oh bennie shes really keen shes got electric boots a mohair suit you know i read it in a magazine oh bbbbennie and the jets ,1.0
72,goodbye yellow brick road,elton john,1974, when are you gonna come down when are you going to land i should have stayed on the farm i should have listened to my old manyou know you cant hold me forever i didnt sign up with you im not a present for your friends to open this boys too young to be singing the bluesso goodbye yellow brick road where the dogs of society howl you cant plant me in your penthouse im going back to my ploughback to the howling old owl in the woods hunting the horny back toad oh ive finally decided my future lies beyond the yellow brick roadwhat do you think youll do then i bet thatll shoot down your plane itll take you a couple of vodka and tonics to set you on your feet againmaybe youll get a replacement theres plenty like me to be found mongrels who aint got a penny sniffing for tidbits like you on the groundso goodbye yellow brick road where the dogs of society howl you cant plant me in your penthouse im going back to my ploughback to the howling old owl in the woods hunting the horny back toad oh ive finally decided my future lies beyond the yellow brick road ,1.0
78,dont let the sun go down on me,elton john,1974, i cant light no more of your darkness all my pictures seem to fade to black and white im growing tired and time stands still before me frozen here on the ladder of my life    meaning  byamandah   editor    on february 27th 2016 elton john performed a free concert on las sunset strip as a thankyou to his aids foundation supporters he welcomed close friend    see all   too late to save myself from falling i took a chance and changed your way of life but you misread my meaning when i met you closed the door and left me blinded by the lightdont let the sun go down on me although i searched myself its always someone else i see id just allow a fragment of your life to wander free but losing everything is like the sun going down on mei cant find the right romantic line but see me once and see the way i feel dont discard me just because you think i mean you harm but these cuts i have they need love to help them heal ,1.0
3,philadelphia freedom,elton john,1975, i used to be a rolling stone you know if a cause was right id leave to find the answer on the road i used to be a heart beating for someone but the times have changed the less i say the more my work gets donecause i live and breathe this philadelphia freedom from the day that i was born ive waved the flag philadelphia freedom took me knee high to a man yeah gave me a piece of mama daddy never hadoh philadelphia freedom shine on me i love you shine the light through the eyes of the ones left behind shine the light shine the light shine the light wont you shine the light philadelphia freedom i loveveve you yes i doif you choose to you can live your life alone some people choose the city some people the city some others choose the good old family home some others choose a good old i like living easy without family ties living easy till the whippoorwill of freedom zapped me right between the eyescause i live and breathe this philadelphia freedom from the day that i was born ive waved the flag philadelphia freedom took me knee high to a man mm mm gave me a piece of mama daddy never hadoh philadelphia freedom shine on me i love you shine the light through the eyes of the ones left behind shine the light shine the light shine the light wont you shine the light philadelphia freedom i loveveve you yes i dooh philadelphia freedom shine on me i love you shine the light through the eyes of the ones left behind shine the light shine the light shine the light wont you shine the light philadelphia freedom i loveveve you know i loveveve  you know i loveveve you yes i do philadelphia freedom i loveveve you yes i do philadelphia freedom you know that i loveveve you yes i do philadelphia freedom dont you know that i loveveve you yes i do philadelphia freedom dont you know that i loveveve you yes i do philadelphia freedom ,1.0
34,lucy in the sky with diamonds,elton john,1975, picture yourself in a boat on a river with tangerine trees and marmalade skies somebody calls you you answer quite slowly a girl with kaleidoscope eyescellophane flowers of yellow and green towering over your head look for the girl with the sun in her eyes and shes gonelucy in the sky with diamonds lucy in the sky with diamonds lucy in the sky with diamonds ohfollow her down to a bridge by a fountain where rockinghorse people eat marshmallow pies everyone smiles as you drift past the flowers that grow so incredibly highnewspaper taxis appear on the shore waiting to take you away climb in the back with your head in the clouds and youre gonelucy in the sky with diamonds lucy in the sky with diamonds lucy in the sky with diamonds ohnewspaper taxis appear on the shore waiting to take you away climb in the back with your head in the clouds and youre gonelucy in the sky with diamonds lucy in the sky with diamonds lucy in the sky with diamonds ohpicture yourself on a train in a station with plasticine porters with lookingglass ties suddenly someone is there at the turnstile the girl with kaleidoscope eyeslucy in the sky with diamonds lucy in the sky with diamonds lucy in the sky with diamonds ohlucy in the sky with diamonds lucy lucy in the sky with diamonds oh lucy lucy in the sky with diamonds oh lucy ohlucy in the sky with diamonds lucy lucy in the sky with diamonds oh lucy lucy in the sky with diamonds oh lucy ohlucy in the sky with diamonds lucy lucy in the sky with diamonds oh lucy lucy in the sky with diamonds oh lucy ohlucy in the sky with diamonds hey oh lucy lucy in the sky with diamonds oh lucy lucy in the sky with diamonds oh lucy ,1.0
91,someone saved my life tonight,elton john,1975, when i think of those east end lights muggy nights the curtains drawn in the little room downstairs prima donna lord you really should have been there sitting like a princess perched in her electric chair and its one more beer and i dont hear you anymore weve all gone crazy lately my friends out there rolling round the basement floorand someone saved my life tonight sugar bear you almost had your hooks in me didnt you dear you nearly had me roped and tied altarbound hypnotized sweet freedom whispered in my ear youre a butterfly and butterflies are free to fly fly away high away bye byei never realized the passing hours of evening showers a slip noose hanging in my darkest dreams im strangled by your haunted social scene just a pawn outplayed by a dominating queen its four oclock in the morning damn it listen to me good im sleeping with myself tonight saved in time thank god my musics still aliveand someone saved my life tonight sugar bear you almost had your hooks in me didnt you dear you nearly had me roped and tied altarbound hypnotized sweet freedom whispered in my ear youre a butterfly and butterflies are free to fly fly away high away bye byeand i would have walked head on into the deep end the river clinging to your stocks and bonds paying your hp demands forever theyre coming in the morning with a truck to take me home someone saved my life tonight someone saved my life tonight someone saved my life tonight someone saved my life tonight someone saved my life tonight so save your strength and run the field you play aloneand someone saved my life tonight sugar bear you almost had your hooks in me didnt you dear you nearly had me roped and tied altarbound hypnotized sweet freedom whispered in my ear youre a butterfly and butterflies are free to fly fly away high away bye byesomeone saved someone saved someone saved my life tonight someone saved someone saved someone saved my life tonight someone saved someone saved someone saved my life tonight someone saved someone saved someone saved my life tonight someone saved someone saved someone saved my life tonight someone saved someone saved someone saved my life tonight ,1.0
65,island girl,elton john,1976, i see your teeth flash jamaican honey so sweet down where lexington cross 47th street oh shes a big girl shes standing sixfoot three turning tricks for the dudes in the big cityisland girl what you wanting with the white mans world island girl black boy want you in his island worldhe want to take you from the racket boss he want to save you but the cause is lost island girl island girl island girl tell me what you wanting with the white mans worldwell shes black as coal but she burn like a fire and she wrap herself around you like a wellworn tire you feel her nail scratch your back just like a rake oh oh he one more gone he one more john who make the mistakeisland girl what you wanting with the white mans world island girl black boy want you in his island worldhe want to take you from the racket boss he want to save you but the cause is lost island girl island girl island girl tell me what you wanting with the white mans worldisland girl what you wanting with the white mans world island girl black boy want you in his island worldhe want to take you from the racket boss he want to save you but the cause is lost island girl island girl island girl tell me what you wanting with the white mans tell me what you wanting with the white mans tell me what you wanting with the white mans ,1.0
95,sorry seems to be the hardest word,elton john,1977, what have i got to do to make you love me what have i got to do to make you care what do i do when lightning strikes me and i wake to find that youre not therewhat have i got to do to make you want me what have i got to do to be heard what do i say when its all over and sorry seems to be the hardest wordits sad so sad so sad its a sad sad situation and its getting more and more absurd its sad so sad so sad why cant we talk it over oh it seems to me that sorry seems to be the hardest wordits sad so sad so sad its a sad sad situation and its getting more and more absurd its sad so sad so sad why cant we talk it over oh it seems to me that sorry seems to be the hardest word ,1.0
36,mama cant buy you love,elton john,1979, baby so they give you anything darling all the joy money can bring baby do they bring you happiness darling youre no different from the restcant you see that its love you really need take my hand and ill show what a love could be before its too latemama dont want you daddy dont want you give it up baby baby mama cant buy you lovemama dont want you daddy dont need you give it up baby baby mama cant buy you lovebaby fancy friends showing you a smile darling rich relations for a while baby i can only give you love darling this old heart should be enoughall i need is a chance to make you mine let me in i can change the way you feel inside before its too latemama dont want you daddy dont want you give it up baby baby mama cant buy you lovemama dont want you daddy dont want you give it up baby baby mama cant buy you lovemama dont want you daddy dont want you give it up baby baby mama cant buy you love  ,1.0
16,little jeannie,elton john,1980, oh little jeannie you got so much love little jeannie and you take it where it strikes and give it to the likes of me oh little jeannie she got so much love little jeannie so i see you when i can you make me all a man can beand i want you to be my acrobat i want you to be my lover oh there were others who would treat you cruel and oh jeannie you were always someones foollittle jeannie you got so much time little jeannie though youve grown beyond your years you still retain the fears of youth oh little jeannie you got so much time little jeannie but youre burning it up so fast searching for some lasting truthand i want you to be my acrobat i want you to be my lover oh there were others who would treat you cruel but oh jeannie i will always be your fooland i want you to be my acrobat i want you to be my lover oh there were others and ive known quite a few but oh oh jeannie im still in love with youyou stepped into my life from a bad dream making the life that i had seem suddenly shiny and new oh jeannie im so in love with youyou stepped into my life from a bad dream making the life that i had seem suddenly shiny and new oh jeannie im so in love with youyou stepped into my life from a bad dream making the life that i had seem suddenly shiny and new oh jeannie im so in love with you  ,1.0
62,blue eyes,elton john,1982, blue eyes babys got blue eyes like a deep blue sea on a blue blue dayblue eyes babys got blue eyes when the morning comes ill be far away and i sayblue eyes holding back the tears holding back the pain babys got blue eyes and shes alone againblue eyes babys got blue eyes like a clear blue sky watching over meblue eyes ooh i love blue eyes when im by her side where i long to be i will seeblue eyes laughing in the sun laughing in the rain babys got blue eyes and i am home and i am home againblue eyes laughing in the sun laughing in the rain babys got blue eyes and i am home again ,1.0
76,empty garden hey hey johnny,elton john,1982, what happened here as the new york sunset disappeared i found an empty garden among the flagstones there who lived here he must have been a gardener that cared a lot who weeded out the tears and grew a good crop and now it all looks strange its funny how one insect can damage so much grainand whats it for this little empty garden by the brownstone door and in the cracks along the sidewalk nothing grows no more who lived here he must have been a gardener that cared a lot who weeded out the tears and grew a good crop and we are so amazed were crippled and were dazed a gardener like that one no one can replaceand ive been knocking but no one answers and ive been knocking most of the day oh and ive been calling oh hey hey johnny cant you come out to playand through their tears some say he farmed his best in younger years but hed have said that roots grow stronger if only he could hear who lived there he must have been a gardener that cared a lot who weeded out the tears and grew a good crop now we pray for rain and with every drop that falls we hear we hear your nameand ive been knocking but no one answers and ive been knocking most of the day oh and ive been calling oh hey hey johnny cant you come out to playand ive been knocking but no one answers and ive been knocking most all the day oh and ive been calling oh hey hey johnny cant you come out can you come out to play johnny cant you come out to play in your empty garden johnny cant you come out to play in your empty garden johnny cant you come out to play in your empty garden johnny cant you come out to play in your empty garden johnny cant you come out to play in your empty garden johnny cant you come out to play in your empty garden johnny ,1.0
74,im still standing,elton john,1983, you could never know what its like your blood like winter freezes just like ice and theres a cold lonely light that shines from you youll wind up like the wreck you hide behind that mask you useand did you think this fool could never win well look at me im coming back again i got a taste of love in a simple way and if you need to know while im still standing you just fade awaydont you know im still standing better than i ever did looking like a true survivor feeling like a little kid im still standing after all this time picking up the pieces of my life without you on my mindim still standing yeah yeah yeah im still standing yeah yeah yeahonce i never could hope to win you starting down the road leaving me again the threats you made were meant to cut me down and if our love was just a circus youd be a clown by nowyou know im still standing better than i ever did looking like a true survivor feeling like a little kid im still standing after all this time picking up the pieces of my life without you on my mindim still standing yeah yeah yeah im still standing yeah yeah yeahdont you know im still standing better than i ever did looking like a true survivor feeling like a little kid im still standing after all this time picking up the pieces of my life without you on my mindim still standing yeah yeah yeah im still standing yeah yeah yeahim still standing yeah yeah yeah im still standing yeah yeah yeah ,1.0
33,i guess thats why they call it the blues,elton john,1984, dont wish it away dont look at it like its forever between you and me i could honestly say that things can only get betterand while im away dust out the demons inside and it wont be long before you and me run to the place in our hearts where we hideand i guess thats why they call it the blues time on my hands could be time spent with you laughing like children living like lovers rolling like thunder under the covers and i guess thats why they call it the bluesjust stare into space picture my face in your hands live for each second without hesitation and never forget im your manwait on me girl cry in the night if it helps but more than ever i simply love you more than i love life itselfand i guess thats why they call it the blues time on my hands could be time spent with you laughing like children living like lovers rolling like thunder under the covers and i guess thats why they call it the blueswait on me girl cry in the night if it helps but more than ever i simply love you more than i love life itselfand i guess thats why they call it the blues time on my hands could be time spent with you laughing like children living like lovers rolling like thunder under the covers and i guess thats why they call it the bluesand i guess thats why they call it the blues and i guess thats why they call it the blues ,1.0
54,sad songs say so much,elton john,1984, guess there are times when we all need to share a little pain and ironing out the rough spots is the hardest part when memories remain and its times like these when we all need to hear the radio cause from the lips of some old singer we can share the troubles we already knowturn em on turn em on turn on those sad songs when all hope is gone why dont you tune in and turn them onthey reach into your room oh oh oh just feel their gentle touch gentle touch when all hope is gone sad songs say so muchif someone else is suffering enough oh to write it down when every single word makes sense then its easier to have those songs around the kick inside is in the line that finally gets to you and it feels so good to hurt so bad and suffer just enough to sing the bluesso turn em on turn em on turn on those sad songs when all hope is gone why dont you tune in and turn them onthey reach into your room oh oh oh just feel their gentle touch gentle touch when all hope is gone you know sad songs say so muchsad songs they say sad songs they say sad songs they say sad songs they say so muchso turn em on turn em on turn em on turn em on turn on those sad songs when all hope is gone why dont you tune in and turn them onthey reach into your room oh oh oh just feel their gentle touch gentle touch when all hope is gone you know sad songs say so much when all hope is gone you know sad songs say so muchwhen ever little bit of hope is gone sad songs say so much when ever little bit of hope is gone sad songs say so much when all hope is gone sad songs say ,1.0
87,nikita,elton john,1986, hey nikita is it cold in your little corner of the world you could roll around the globe and never find a warmer soul to knowoh i saw you by the wall ten of your tin soldiers in a row with eyes that looked like ice on fire the human heart a captive in the snowoh nikita you will never know anything about my home ill never know how good it feels to hold you nikita i need you so oh nikita is the other side of any given line in time counting ten tin soldiers in a row oh no nikita youll never knowdo you ever dream of me do you ever see the letters that i write when you look up through the wire nikita do you count the stars at nightand if there comes a time guns and gates no longer hold you in and if youre free to make a choice just look towards the west and find a friendoh nikita you will never know anything about my home ill never know how good it feels to hold you nikita i need you so oh nikita is the other side of any given line in time counting ten tin soldiers in a row oh no nikita youll never knowoh nikita you will never know anything about my home ill never know how good it feels to hold you nikita i need you so oh nikita is the other side of any given line in time counting ten tin soldiers in a row oh no nikita youll never knownikita counting ten tin soldiers in a row nikita counting ten tin soldiers in a row nikita counting ten tin soldiers in a row nikita ,1.0
